{
  "$schema": "https://json-schema.org/draft/2020-12/schema",
  "$id": "https://www.moraltrade.org/schemas/moral-trade/security-profile.schema.json",
  "title": "Moral Trade Security Profile",
  "type": "object",
  "required": ["version", "purpose", "controls", "scaleGates", "publicNonClaims", "securityTests"],
  "properties": {
    "version": { "type": "string", "minLength": 1 },
    "purpose": { "type": "string", "minLength": 1 },
    "controls": {
      "type": "array",
      "minItems": 8,
      "items": {
        "type": "object",
        "required": ["key", "label", "status", "evidence", "publicClaim"],
        "properties": {
          "key": { "type": "string", "minLength": 1 },
          "label": { "type": "string", "minLength": 1 },
          "status": {
            "enum": ["implemented", "provider_boundary", "required_before_scale", "not_claimed"]
          },
          "evidence": { "type": "string", "minLength": 1 },
          "publicClaim": { "type": "string", "minLength": 1 }
        },
        "additionalProperties": false
      }
    },
    "scaleGates": {
      "type": "array",
      "minItems": 3,
      "items": {
        "type": "object",
        "required": ["key", "label", "requires", "rule"],
        "properties": {
          "key": { "type": "string", "minLength": 1 },
          "label": { "type": "string", "minLength": 1 },
          "requires": {
            "type": "array",
            "minItems": 1,
            "items": { "type": "string", "minLength": 1 },
            "uniqueItems": true
          },
          "rule": { "type": "string", "minLength": 1 }
        },
        "additionalProperties": false
      }
    },
    "publicNonClaims": {
      "type": "array",
      "minItems": 3,
      "items": { "type": "string", "minLength": 1 },
      "uniqueItems": true
    },
    "securityTests": {
      "type": "array",
      "minItems": 4,
      "items": { "type": "string", "minLength": 1 },
      "uniqueItems": true
    }
  },
  "additionalProperties": false
}
